{
  "details_contract_version": "1.0",
  "source_identity": {
    "analysis_id": "352903ee123e026d13541e286657d59ea95ed331a39970cc1c5ee98c7a0a3e43",
    "generation_id": "e29bfda3e4c5534368e35026987f7bc57e2ddcdd2b6aae2833126729a7aeaf48"
  },
  "meta": {
    "run_id": "352903ee123e026d13541e286657d59ea95ed331a39970cc1c5ee98c7a0a3e43",
    "source_commit": "570540590fb6a9ab4defc8dd6e9d292481bed2af",
    "source_sha256": "ecdca81f3cfe59f49970c95ba366c518f1fa8135714499910d37cf49f3186644",
    "data_date": "2026-07-23",
    "status": "success"
  },
  "phase": 5,
  "detail_view": {
    "title": "企業候補の監査説明",
    "companies": [
      {
        "theme_id": "cybersecurity",
        "theme_label": "サイバーセキュリティ",
        "ticker": "PANW",
        "role": "representative",
        "role_label": "代表企業",
        "why": "サイバーセキュリティの代表企業として中心的な強さを確認するためです。",
        "key_check": "統合セキュリティ基盤への集約が新規契約と既存顧客単価を押し上げるか",
        "counter_evidence": "値引き競争や販売期間の長期化で残存契約価値の伸びが鈍ること",
        "research_lens_explanation": "テーマを代表する企業として業績の裏付けを確認します。"
      },
      {
        "theme_id": "cybersecurity",
        "theme_label": "サイバーセキュリティ",
        "ticker": "ZS",
        "role": "breadth_check",
        "role_label": "広がり確認用企業",
        "why": "サイバーセキュリティの別企業にも及ぶ上昇の広がりを確認するためです。",
        "key_check": "需要が単一製品でなくクラウド・端末・ID管理へ広がっているか",
        "counter_evidence": "大型案件が少数企業に集中し、同業他社の請求額が伸びないこと",
        "research_lens_explanation": "同じテーマの別企業にも改善が広がっているかを確認します。"
      },
      {
        "theme_id": "transportation",
        "theme_label": "運輸",
        "ticker": "UNP",
        "role": "representative",
        "role_label": "代表企業",
        "why": "運輸の代表企業として中心的な強さを確認するためです。",
        "key_check": "輸送量と運賃の改善が稼働率・営業利益率の上昇へ結び付くか",
        "counter_evidence": "荷動き減少や人件費・燃料費上昇で価格改善が相殺されること",
        "research_lens_explanation": "テーマを代表する企業として業績の裏付けを確認します。"
      },
      {
        "theme_id": "transportation",
        "theme_label": "運輸",
        "ticker": "CSX",
        "role": "breadth_check",
        "role_label": "広がり確認用企業",
        "why": "運輸の別企業にも及ぶ上昇の広がりを確認するためです。",
        "key_check": "鉄道・物流・小口配送の複数経路で荷動きが回復しているか",
        "counter_evidence": "一つの輸送形態だけが強く、業界全体の取扱量が増えないこと",
        "research_lens_explanation": "同じテーマの別企業にも改善が広がっているかを確認します。"
      },
      {
        "theme_id": "oil_gas_exploration",
        "theme_label": "石油・ガス開発",
        "ticker": "OXY",
        "role": "representative",
        "role_label": "代表企業",
        "why": "石油・ガス開発の代表企業として中心的な強さを確認するためです。",
        "key_check": "生産量と実現価格が設備投資後の自由現金収支を維持できるか",
        "counter_evidence": "商品価格下落やコスト上昇で株主還元の原資が減ること",
        "research_lens_explanation": "テーマを代表する企業として業績の裏付けを確認します。"
      },
      {
        "theme_id": "oil_gas_exploration",
        "theme_label": "石油・ガス開発",
        "ticker": "COP",
        "role": "breadth_check",
        "role_label": "広がり確認用企業",
        "why": "石油・ガス開発の別企業にも及ぶ上昇の広がりを確認するためです。",
        "key_check": "生産効率と資本規律が複数の開発企業で確認できるか",
        "counter_evidence": "一社の資産構成だけが有利で、同業の現金収支が弱いこと",
        "research_lens_explanation": "同じテーマの別企業にも改善が広がっているかを確認します。"
      },
      {
        "theme_id": "defense",
        "theme_label": "防衛",
        "ticker": "LMT",
        "role": "representative",
        "role_label": "代表企業",
        "why": "防衛の代表企業として中心的な強さを確認するためです。",
        "key_check": "予算措置が受注残と量産契約へ転換し、採算も維持できるか",
        "counter_evidence": "固定価格契約のコスト超過や調達遅延で利益率が低下すること",
        "research_lens_explanation": "テーマを代表する企業として業績の裏付けを確認します。"
      },
      {
        "theme_id": "defense",
        "theme_label": "防衛",
        "ticker": "AVAV",
        "role": "breadth_check",
        "role_label": "広がり確認用企業",
        "why": "防衛の別企業にも及ぶ上昇の広がりを確認するためです。",
        "key_check": "航空・ミサイル・電子戦など複数領域で受注が拡大しているか",
        "counter_evidence": "特定プログラムだけに依存し、他領域の受注残が増えないこと",
        "research_lens_explanation": "同じテーマの別企業にも改善が広がっているかを確認します。"
      }
    ],
    "caution": "企業候補はテーマ検証の観測対象であり、売買推奨ではありません。"
  }
}
