{
  "details_contract_version": "1.0",
  "source_identity": {
    "analysis_id": "8544cc3923e0ed84c3ec32bfc03bf9644947b2d889ac5caa6effb2765e3cdf16",
    "generation_id": "6fa376320c04fc2d4cc4191a7ffeb500f434c4cf949dd3f9297a7ca6941f59a6"
  },
  "meta": {
    "run_id": "8544cc3923e0ed84c3ec32bfc03bf9644947b2d889ac5caa6effb2765e3cdf16",
    "source_commit": "470adcd315bcea2b97c0df1c976524c5733240bb",
    "source_sha256": "d0a10a36faf20e6c0db909459c587fea40f0c1c8fcb95b96fedec7c57c29b4c5",
    "data_date": "2026-08-03",
    "status": "success"
  },
  "phase": 4,
  "detail_view": {
    "title": "テーマ4分類の監査説明",
    "buckets": [
      {
        "bucket": "research_now",
        "label": "今調べる候補",
        "explanation": "相対強度、広がり、集中度などが現在の調査条件を満たしています。",
        "items": [
          {
            "id": "oil_gas_exploration",
            "label": "石油・ガス開発",
            "source": "dynamic_industry",
            "classification_explanation": "現在の相対強度、広がり、集中度が調査を進める条件を満たしています。",
            "relative_strength_4w": 0.11565512754595142,
            "breadth_above_50dma": 1.0,
            "concentration_top1": 0.24980575613501416,
            "structural_context_status": "not_assessed",
            "recovery_condition": "相対強度と上昇銘柄の広がりが同時に改善するかを次回確認します。",
            "largest_counter_evidence": "明示的な反対条件は検出されていません。"
          }
        ]
      },
      {
        "bucket": "watch_recovery",
        "label": "回復確認候補",
        "explanation": "現時点では不足があり、回復条件の確認を待つ分類です。",
        "items": [
          {
            "id": "transportation",
            "label": "運輸",
            "source": "dynamic_industry",
            "classification_explanation": "中期の強さを残す一方、直近の回復確認が必要です。",
            "relative_strength_4w": -0.006785713024301254,
            "breadth_above_50dma": 0.5,
            "concentration_top1": 0.471313265200911,
            "structural_context_status": "not_assessed",
            "recovery_condition": "相対強度と上昇銘柄の広がりが同時に改善するかを次回確認します。",
            "largest_counter_evidence": "明示的な反対条件は検出されていません。"
          },
          {
            "id": "ai_semis",
            "label": "AI半導体",
            "source": "fixed_theme",
            "classification_explanation": "中期の強さを残す一方、直近の回復確認が必要です。",
            "relative_strength_4w": -0.13704624928383768,
            "breadth_above_50dma": 0.0,
            "concentration_top1": 0.5748041764668363,
            "structural_context_status": "not_assessed",
            "recovery_condition": "相対強度と上昇銘柄の広がりが同時に改善するかを次回確認します。",
            "largest_counter_evidence": "直接的な資金フロー確認はありません。"
          },
          {
            "id": "semi_equipment",
            "label": "半導体製造装置",
            "source": "fixed_theme",
            "classification_explanation": "中期の強さを残す一方、直近の回復確認が必要です。",
            "relative_strength_4w": -0.15942008289927218,
            "breadth_above_50dma": 0.0,
            "concentration_top1": null,
            "structural_context_status": "not_assessed",
            "recovery_condition": "相対強度と上昇銘柄の広がりが同時に改善するかを次回確認します。",
            "largest_counter_evidence": "直接的な資金フロー確認はありません。"
          }
        ]
      },
      {
        "bucket": "long_term_context_price_weak",
        "label": "長期文脈はあるが価格が弱い候補",
        "explanation": "構造的背景と足元の価格状態を分けて扱う分類です。",
        "items": []
      },
      {
        "bucket": "avoid_now",
        "label": "今は避ける候補",
        "explanation": "反対材料または弱い価格条件が優勢な分類です。",
        "items": [
          {
            "id": "biotechnology",
            "label": "バイオテクノロジー",
            "source": "dynamic_industry",
            "classification_explanation": "現在の価格、広がり、集中度または反対材料から、調査優先度を下げています。",
            "relative_strength_4w": -0.05726727766069565,
            "breadth_above_50dma": 0.8333333333333334,
            "concentration_top1": 0.9081822211416677,
            "structural_context_status": "not_assessed",
            "recovery_condition": "相対強度と上昇銘柄の広がりが同時に改善するかを次回確認します。",
            "largest_counter_evidence": "明示的な反対条件は検出されていません。"
          },
          {
            "id": "homebuilders",
            "label": "住宅建設",
            "source": "dynamic_industry",
            "classification_explanation": "現在の価格、広がり、集中度または反対材料から、調査優先度を下げています。",
            "relative_strength_4w": -0.06454452799232176,
            "breadth_above_50dma": 0.4,
            "concentration_top1": null,
            "structural_context_status": "not_assessed",
            "recovery_condition": "相対強度と上昇銘柄の広がりが同時に改善するかを次回確認します。",
            "largest_counter_evidence": "明示的な反対条件は検出されていません。"
          },
          {
            "id": "infrastructure_construction",
            "label": "インフラ建設",
            "source": "dynamic_industry",
            "classification_explanation": "現在の価格、広がり、集中度または反対材料から、調査優先度を下げています。",
            "relative_strength_4w": -0.10430156601745214,
            "breadth_above_50dma": 0.0,
            "concentration_top1": 1.0,
            "structural_context_status": "not_assessed",
            "recovery_condition": "相対強度と上昇銘柄の広がりが同時に改善するかを次回確認します。",
            "largest_counter_evidence": "明示的な反対条件は検出されていません。"
          },
          {
            "id": "regional_banks",
            "label": "地方銀行",
            "source": "dynamic_industry",
            "classification_explanation": "現在の価格、広がり、集中度または反対材料から、調査優先度を下げています。",
            "relative_strength_4w": 0.00803647202596458,
            "breadth_above_50dma": 1.0,
            "concentration_top1": 0.38917183267206285,
            "structural_context_status": "not_assessed",
            "recovery_condition": "相対強度と上昇銘柄の広がりが同時に改善するかを次回確認します。",
            "largest_counter_evidence": "明示的な反対条件は検出されていません。"
          },
          {
            "id": "retail",
            "label": "小売",
            "source": "dynamic_industry",
            "classification_explanation": "現在の価格、広がり、集中度または反対材料から、調査優先度を下げています。",
            "relative_strength_4w": 0.01176449274301259,
            "breadth_above_50dma": 0.6,
            "concentration_top1": 0.8540738006208131,
            "structural_context_status": "not_assessed",
            "recovery_condition": "相対強度と上昇銘柄の広がりが同時に改善するかを次回確認します。",
            "largest_counter_evidence": "明示的な反対条件は検出されていません。"
          },
          {
            "id": "ai_software_data",
            "label": "AIソフトウェア・データ基盤",
            "source": "fixed_theme",
            "classification_explanation": "現在の価格、広がり、集中度または反対材料から、調査優先度を下げています。",
            "relative_strength_4w": 0.07842332283980716,
            "breadth_above_50dma": 0.7142857142857143,
            "concentration_top1": 0.40155438518491415,
            "structural_context_status": "not_assessed",
            "recovery_condition": "相対強度と上昇銘柄の広がりが同時に改善するかを次回確認します。",
            "largest_counter_evidence": "直接的な資金フロー確認はありません。"
          },
          {
            "id": "cybersecurity",
            "label": "サイバーセキュリティ",
            "source": "fixed_theme",
            "classification_explanation": "現在の価格、広がり、集中度または反対材料から、調査優先度を下げています。",
            "relative_strength_4w": 0.04047803586964909,
            "breadth_above_50dma": 1.0,
            "concentration_top1": 0.44493458830896704,
            "structural_context_status": "not_assessed",
            "recovery_condition": "相対強度と上昇銘柄の広がりが同時に改善するかを次回確認します。",
            "largest_counter_evidence": "直接的な資金フロー確認はありません。"
          },
          {
            "id": "dc_power_infra",
            "label": "データセンター電力・インフラ",
            "source": "fixed_theme",
            "classification_explanation": "現在の価格、広がり、集中度または反対材料から、調査優先度を下げています。",
            "relative_strength_4w": -0.04849435305926206,
            "breadth_above_50dma": 0.375,
            "concentration_top1": 0.6779150408850685,
            "structural_context_status": "not_assessed",
            "recovery_condition": "相対強度と上昇銘柄の広がりが同時に改善するかを次回確認します。",
            "largest_counter_evidence": "反対条件が検出されています。次回の価格と広がりで再確認します。"
          },
          {
            "id": "defense",
            "label": "防衛",
            "source": "fixed_theme",
            "classification_explanation": "現在の価格、広がり、集中度または反対材料から、調査優先度を下げています。",
            "relative_strength_4w": -0.03641154829024923,
            "breadth_above_50dma": 0.5,
            "concentration_top1": 0.4847474607520061,
            "structural_context_status": "not_assessed",
            "recovery_condition": "相対強度と上昇銘柄の広がりが同時に改善するかを次回確認します。",
            "largest_counter_evidence": "直接的な資金フロー確認はありません。"
          },
          {
            "id": "networking_optical",
            "label": "ネットワーク・光通信",
            "source": "fixed_theme",
            "classification_explanation": "現在の価格、広がり、集中度または反対材料から、調査優先度を下げています。",
            "relative_strength_4w": -0.13641979384861547,
            "breadth_above_50dma": 0.14285714285714285,
            "concentration_top1": 1.0,
            "structural_context_status": "not_assessed",
            "recovery_condition": "相対強度と上昇銘柄の広がりが同時に改善するかを次回確認します。",
            "largest_counter_evidence": "反対条件が検出されています。次回の価格と広がりで再確認します。"
          },
          {
            "id": "nuclear_uranium",
            "label": "原子力・ウラン",
            "source": "fixed_theme",
            "classification_explanation": "現在の価格、広がり、集中度または反対材料から、調査優先度を下げています。",
            "relative_strength_4w": -0.06275241400057952,
            "breadth_above_50dma": 0.2857142857142857,
            "concentration_top1": 0.5311656910992703,
            "structural_context_status": "not_assessed",
            "recovery_condition": "相対強度と上昇銘柄の広がりが同時に改善するかを次回確認します。",
            "largest_counter_evidence": "直接的な資金フロー確認はありません。"
          }
        ]
      }
    ]
  }
}
