{
  "details_contract_version": "1.0",
  "source_identity": {
    "analysis_id": "ddd12cd862d8798a69811acf9d711c6d25b9b22820369c3e8481914e50c33253",
    "generation_id": "981172bcedb346c7d1199450631dd4995234e54afe560cf60ce47d63bddeb25f"
  },
  "meta": {
    "run_id": "ddd12cd862d8798a69811acf9d711c6d25b9b22820369c3e8481914e50c33253",
    "source_commit": "2c79c9ffb6dbda122ad8fc1ef17ccb626567b30c",
    "source_sha256": "a303de70af28eaa996e57ca61be7215c27655252ebfe0a10094ac74858b46230",
    "data_date": "2026-07-31",
    "status": "success"
  },
  "phase": 6,
  "detail_view": {
    "title": "最終判断要約の監査説明",
    "market_basis": [
      "市場分類: real_asset_leadership",
      "信頼度: medium",
      "市場、スタイル、セクター、テーマ、企業の順に同一snapshotを確認しています。"
    ],
    "bucket_counts": {
      "research_now": 1,
      "watch_recovery": 3,
      "long_term_context_price_weak": 0,
      "avoid_now": 11
    },
    "company_count": 2,
    "analysis_mode": "initial_observation",
    "constraints": [
      "OVERLAP:CEG",
      "OVERLAP:PLTR",
      "OVERLAP:VST"
    ],
    "change_conditions": [
      "次週に相対強度、上昇銘柄の広がり、移動平均位置、集中度が変化した場合は分類が変わり得ます。",
      "新しい公開データは「更新」でのみ取得し、会話途中に別generationを混ぜません。"
    ],
    "not_implemented": [
      "ETF・fundの直接的な資金フローデータは現在の分析に直接使用していません。",
      "投資家ポジショニングデータは現在の分析に直接使用していません。",
      "時点整合した時価総額データは現在の分析に直接使用していません。"
    ]
  }
}
