{
  "details_contract_version": "1.0",
  "source_identity": {
    "analysis_id": "352903ee123e026d13541e286657d59ea95ed331a39970cc1c5ee98c7a0a3e43",
    "generation_id": "e29bfda3e4c5534368e35026987f7bc57e2ddcdd2b6aae2833126729a7aeaf48"
  },
  "meta": {
    "run_id": "352903ee123e026d13541e286657d59ea95ed331a39970cc1c5ee98c7a0a3e43",
    "source_commit": "570540590fb6a9ab4defc8dd6e9d292481bed2af",
    "source_sha256": "ecdca81f3cfe59f49970c95ba366c518f1fa8135714499910d37cf49f3186644",
    "data_date": "2026-07-23",
    "status": "success"
  },
  "phase": 1,
  "detail_view": {
    "title": "市場環境の監査説明",
    "market_environment": {
      "classification": "real_asset_leadership",
      "secondary": [],
      "confidence": "medium",
      "explanation": "複数の市場指標を同時に照合した分類です。単一指標だけで判断していません。"
    },
    "representative_indicators": [
      {
        "name": "spy_r_4w",
        "label": "S&P 500の4週騰落率",
        "value": 0.006270584638041088,
        "explanation": "市場平均そのものの中期的な方向を示します。"
      },
      {
        "name": "qqq_rel_spy_4w",
        "label": "大型成長株の相対強度",
        "value": -0.036663636833638935,
        "explanation": "NASDAQ 100がS&P 500を4週間でどれだけ上回ったかを示します。"
      },
      {
        "name": "rsp_minus_spy_4w",
        "label": "均等加重の広がり",
        "value": 0.008234651553974626,
        "explanation": "大型株だけでなく幅広い銘柄へ上昇が及んでいるかを見る目安です。"
      },
      {
        "name": "iwm_minus_spy_4w",
        "label": "小型株の相対強度",
        "value": -0.01720790993338428,
        "explanation": "小型株が市場平均を上回っているかを見る目安です。"
      },
      {
        "name": "hyg_minus_lqd_4w",
        "label": "信用リスク選好",
        "value": 0.01748835842697971,
        "explanation": "低格付け債と高格付け債の差からリスク選好を確認します。"
      },
      {
        "name": "vix_change_4w",
        "label": "VIXの4週変化",
        "value": -0.7899990081787109,
        "explanation": "市場の不安感が拡大したか低下したかを見る補助指標です。"
      }
    ],
    "breadth": {
      "sector_advance_ratio_4w": 0.5454545454545454,
      "explanation": "主要11セクターのうち4週間で上昇した割合です。上昇の広がりを確認します。"
    },
    "risk_posture": [
      "景気敏感株・防御株・実物資産・信用市場を横断し、偏りを確認しています。",
      "価格変化だけを資金流入または流出の直接証拠とは扱いません。"
    ],
    "global_quality": {
      "coverage_ratio": 0.9929078014184397,
      "requested_ticker_count": 141,
      "usable_ticker_count": 140,
      "critical_missing": []
    },
    "warnings": [
      "OVERLAP:CEG",
      "OVERLAP:PLTR",
      "OVERLAP:VST"
    ],
    "constraints": [
      "未実装: ETF・fundの直接的な資金フローデータ",
      "未実装: 業績予想の上方・下方修正データ",
      "未実装: 投資家ポジショニングデータ",
      "未実装: 時点整合した時価総額データ"
    ]
  }
}
